<?xml version="1.0" encoding="UTF-8"?>
<annotation xmlns="http://www.tgen.org"
 xmlns:xsi="http://www.w3.org/2001/XMLSchema-instance"
 xsi:schemaLocation="http://www.tgen.org file:/Users/preston/Developer/git/acraf/acraf.xsd">
    <disease meshid="nQMAG1y"/>
    <compound pubchemid="-863457491" name="RG5g49vovfWWQNvBtBdOva"/>
    <protein-aberration xmlns:tgen="http://www.tgen.org" xsi:type="tgen:dna-aberration-type" level="substitution" name="td6wO_Pd" phenotype="resistence" cosmicid="Mdnpo6zvZ7e" priority="low">
        <description>Cd</description>
        <gene hugoid="ZF74ufd_JRSjYJa1nV3hQDAiJzJww" entrezid="_nKvQqqHdamh-lzrZT"/>
        <pathway name="iC0TylV33PCN.u"/>
        <links>
            <pubmed id="-442312361"/>
            <pubmed id="1263000279"/>
            <pubmed id="1105351940"/>
        </links>
    </protein-aberration>
</annotation>
